{
  "_provenance": {
    "source_path": "FFXIV 1.x client install, game.ver 2012.09.19.0001",
    "method": "MapLayoutResourceData blob string pools (Bk_resident primaries) joined to zone ids via _layout.csv region-series slot positions and bijective _zoneParam.csv placeName ids; a sole zone name stands in when Bk_resident is a stage alias, while shared placeName ids remain unbound.",
    "evidence_class": "client_extraction",
    "limitations": [
      "zoneBindings covers only placeName-bijective zones; instanced copies and sub-area variants sharing a placeName with a sibling are not client-discriminable and stay unbound.",
      "Slot names for unshipped layouts (blobShipped false) come from the series slot rule, not from a blob string.",
      "Market/ocn/inn/roc1 family blobs carry name evidence but no series slots, so they contribute vocabulary only."
    ],
    "generator": "tools/build_zone_name_catalog.py"
  },
  "families": {
    "sea": {
      "dataSubdir": "29/D9/00",
      "resourceBaseHex": "0x29D90000"
    },
    "fst": {
      "dataSubdir": "29/B0/00",
      "resourceBaseHex": "0x29B00000"
    },
    "roc": {
      "dataSubdir": "28/D9/00",
      "resourceBaseHex": "0x28D90000"
    },
    "wil": {
      "dataSubdir": "61/5A/00",
      "resourceBaseHex": "0x615A0000"
    },
    "lak": {
      "dataSubdir": "03/E7/00",
      "resourceBaseHex": "0x03E70000"
    },
    "mkt_sea": {
      "dataSubdir": "72/42/00",
      "resourceBaseHex": "0x72420000"
    },
    "mkt_fst": {
      "dataSubdir": "72/9F/00",
      "resourceBaseHex": "0x729F0000"
    },
    "mkt_wil": {
      "dataSubdir": "72/A6/00",
      "resourceBaseHex": "0x72A60000"
    },
    "ocn": {
      "dataSubdir": "2B/03/00",
      "resourceBaseHex": "0x2B030000"
    },
    "inn": {
      "dataSubdir": "A0/9B/00",
      "resourceBaseHex": "0xA09B0000"
    },
    "roc1": {
      "dataSubdir": "AB/F4/00",
      "resourceBaseHex": "0xABF40000"
    }
  },
  "blobs": [
    {
      "resourceIdHex": "0x29D90001",
      "family": "sea",
      "primaryName": "sea0Town01",
      "zoneNames": [
        "sea0Town01",
        "sea0Town01a"
      ]
    },
    {
      "resourceIdHex": "0x29D90002",
      "family": "sea",
      "primaryName": "sea0Town01",
      "zoneNames": [
        "sea0Town01",
        "sea0Town01a"
      ]
    },
    {
      "resourceIdHex": "0x29D90003",
      "family": "sea",
      "primaryName": "sea0Field01",
      "zoneNames": [
        "sea0Field01",
        "sea0Field01a",
        "sea0Field02",
        "sea0Field03",
        "sea0Town01"
      ]
    },
    {
      "resourceIdHex": "0x29D90004",
      "family": "sea",
      "primaryName": "sea0Field02",
      "zoneNames": [
        "sea0Field02",
        "sea0Field02a",
        "sea0Hamlet01",
        "sea0Hamlet01a",
        "sea0Hamlet01b"
      ]
    },
    {
      "resourceIdHex": "0x29D90005",
      "family": "sea",
      "primaryName": "sea0Field03",
      "zoneNames": [
        "sea0Field03",
        "sea0Field03a"
      ]
    },
    {
      "resourceIdHex": "0x29D90006",
      "family": "sea",
      "primaryName": "sea0Field04",
      "zoneNames": [
        "sea0Dungeon06",
        "sea0Field02",
        "sea0Field03",
        "sea0Field04"
      ]
    },
    {
      "resourceIdHex": "0x29D90007",
      "family": "sea",
      "primaryName": "sea0Field05",
      "zoneNames": [
        "sea0Field05"
      ]
    },
    {
      "resourceIdHex": "0x29D90008",
      "family": "sea",
      "primaryName": null,
      "zoneNames": [
        "sea0Dungeon01",
        "sea0Field02"
      ]
    },
    {
      "resourceIdHex": "0x29D90009",
      "family": "sea",
      "primaryName": "sea0Dungeon02",
      "zoneNames": [
        "sea0Dungeon02"
      ]
    },
    {
      "resourceIdHex": "0x29D9000A",
      "family": "sea",
      "primaryName": "sea0Dungeon03",
      "zoneNames": [
        "sea0Dungeon03",
        "sea0Field03"
      ]
    },
    {
      "resourceIdHex": "0x29D9000B",
      "family": "sea",
      "primaryName": "sea0Dungeon04",
      "zoneNames": [
        "sea0Dungeon04",
        "sea0Field01a"
      ]
    },
    {
      "resourceIdHex": "0x29D9000C",
      "family": "sea",
      "primaryName": "sea0Dungeon05",
      "zoneNames": [
        "sea0Dungeon05"
      ]
    },
    {
      "resourceIdHex": "0x29D9000D",
      "family": "sea",
      "primaryName": "sea0Dungeon06",
      "zoneNames": [
        "sea0Dungeon06"
      ]
    },
    {
      "resourceIdHex": "0x29B00001",
      "family": "fst",
      "primaryName": "fst0Town01a",
      "zoneNames": [
        "fst0Town01",
        "fst0Town01a"
      ]
    },
    {
      "resourceIdHex": "0x29B00002",
      "family": "fst",
      "primaryName": "fst0Town01a",
      "zoneNames": [
        "fst0Town01",
        "fst0Town01a"
      ]
    },
    {
      "resourceIdHex": "0x29B00003",
      "family": "fst",
      "primaryName": "fst0Field01",
      "zoneNames": [
        "fst0Battle01",
        "fst0Battle02",
        "fst0Battle03",
        "fst0Battle04",
        "fst0Battle05",
        "fst0Field01",
        "fst0Field01a",
        "fst0Field02",
        "fst0Field03",
        "fst0Field04",
        "fst0Field05",
        "fst0Town01",
        "fst0Town01a"
      ]
    },
    {
      "resourceIdHex": "0x29B00004",
      "family": "fst",
      "primaryName": "fst0Field02",
      "zoneNames": [
        "fst0Field02"
      ]
    },
    {
      "resourceIdHex": "0x29B00005",
      "family": "fst",
      "primaryName": "fst0Field03",
      "zoneNames": [
        "fst0Field03",
        "fst0Field03a",
        "fst0Hamlet01",
        "fst0Hamlet01a",
        "fst0Hamlet01b"
      ]
    },
    {
      "resourceIdHex": "0x29B00006",
      "family": "fst",
      "primaryName": "fst0Field04",
      "zoneNames": [
        "fst0Field04",
        "fst0Field04a"
      ]
    },
    {
      "resourceIdHex": "0x29B00007",
      "family": "fst",
      "primaryName": "fst0Field05",
      "zoneNames": [
        "fst0Field05",
        "fst0Field05a"
      ]
    },
    {
      "resourceIdHex": "0x29B00008",
      "family": "fst",
      "primaryName": "fst0Dungeon01",
      "zoneNames": [
        "fst0Dungeon01",
        "fst0Field03"
      ]
    },
    {
      "resourceIdHex": "0x29B00009",
      "family": "fst",
      "primaryName": "fst0Dungeon02",
      "zoneNames": [
        "fst0Dungeon02",
        "fst0Field01"
      ]
    },
    {
      "resourceIdHex": "0x29B0000A",
      "family": "fst",
      "primaryName": "fst0Dungeon03",
      "zoneNames": [
        "fst0Dungeon03",
        "fst0Field05a"
      ]
    },
    {
      "resourceIdHex": "0x29B0000B",
      "family": "fst",
      "primaryName": "fst0Dungeon04",
      "zoneNames": [
        "fst0Dungeon04",
        "fst0Field02"
      ]
    },
    {
      "resourceIdHex": "0x29B0000C",
      "family": "fst",
      "primaryName": "fst0Dungeon05",
      "zoneNames": [
        "fst0Dungeon05",
        "fst0Field03"
      ]
    },
    {
      "resourceIdHex": "0x29B0000D",
      "family": "fst",
      "primaryName": "fst0Dungeon06",
      "zoneNames": [
        "fst0Dungeon06",
        "fst0Field04"
      ]
    },
    {
      "resourceIdHex": "0x28D90001",
      "family": "roc",
      "primaryName": "roc0Field01",
      "zoneNames": [
        "roc0Field01",
        "roc0Field03",
        "roc0Field04",
        "roc0Field05"
      ]
    },
    {
      "resourceIdHex": "0x28D90002",
      "family": "roc",
      "primaryName": "roc0Field02",
      "zoneNames": [
        "roc0Field01",
        "roc0Field02",
        "roc0Field02a",
        "roc0Field02b",
        "roc0Field02c"
      ]
    },
    {
      "resourceIdHex": "0x28D90003",
      "family": "roc",
      "primaryName": "roc0Field03",
      "zoneNames": [
        "roc0Field01",
        "roc0Field03"
      ]
    },
    {
      "resourceIdHex": "0x28D90004",
      "family": "roc",
      "primaryName": "roc0Field04",
      "zoneNames": [
        "roc0Field04"
      ]
    },
    {
      "resourceIdHex": "0x28D90005",
      "family": "roc",
      "primaryName": "roc0Field05",
      "zoneNames": [
        "roc0Field01",
        "roc0Field05"
      ]
    },
    {
      "resourceIdHex": "0x28D90009",
      "family": "roc",
      "primaryName": "roc0Dungeon04",
      "zoneNames": [
        "roc0Dungeon04",
        "roc0Field04"
      ]
    },
    {
      "resourceIdHex": "0x28D9000B",
      "family": "roc",
      "primaryName": "roc0Dungeon06",
      "zoneNames": [
        "roc0Dungeon06"
      ]
    },
    {
      "resourceIdHex": "0x615A0001",
      "family": "wil",
      "primaryName": "wil0Town01",
      "zoneNames": [
        "wil0Battle01",
        "wil0Battle02",
        "wil0Battle03",
        "wil0Battle04",
        "wil0Battle05",
        "wil0Field01",
        "wil0Town01",
        "wil0Town01a"
      ]
    },
    {
      "resourceIdHex": "0x615A0003",
      "family": "wil",
      "primaryName": "wil0Town01a",
      "zoneNames": [
        "wil0Battle01",
        "wil0Battle02",
        "wil0Battle03",
        "wil0Battle04",
        "wil0Battle05",
        "wil0Town01",
        "wil0Town01a"
      ]
    },
    {
      "resourceIdHex": "0x615A0004",
      "family": "wil",
      "primaryName": "wil0Field01",
      "zoneNames": [
        "wil0Field01",
        "wil0Field01a",
        "wil0Field03",
        "wil0Town01"
      ]
    },
    {
      "resourceIdHex": "0x615A0005",
      "family": "wil",
      "primaryName": "wil0Field02",
      "zoneNames": [
        "wil0Field01",
        "wil0Field02",
        "wil0Field02a",
        "wil0Hamlet01",
        "wil0Hamlet01a",
        "wil0Hamlet01b"
      ]
    },
    {
      "resourceIdHex": "0x615A0006",
      "family": "wil",
      "primaryName": "wil0Field03",
      "zoneNames": [
        "wil0Dungeon04",
        "wil0Field03",
        "wil0Field03a"
      ]
    },
    {
      "resourceIdHex": "0x615A0007",
      "family": "wil",
      "primaryName": "wil0Field04",